available;categoryId;currencyId;delivery;description;id;local_delivery_cost;manufacturer_warranty;modified_time;name;oldprice;param;pickup;picture;price;store;type;url;vendor;vendorCode
true;Eyeglasses;USD;true;It is an oval metal frame with timeless appeal. The medium-wide frame has a high-shine finish. Acetate temple tips and adjustable nose pads provide added comfort.  ;4129;0.00;true;1724502653;100335 Oval Eyeglasses;19.95;black;false;https://www.glasseslit.com/Public/img/products/100335/C1_0.jpg;5;false;;https://codeaven.com/g/mmjnepjawo1e88db6f11de0721ef8d/?f_id=17760&ulp=https%3A%2F%2Fwww.glasseslit.com%2Fproinfo%2F100335-black-100335;Glasseslit;100335
true;Eyeglasses;USD;true;These half-rim glasses feature a stainless steel frame front with acetate temple arms. The medium-wide frame is available in brown with tortoiseshell temple arms  or black with tortoiseshell temple arms. Silicone nose pads and spring hinges provide a comfortable fit.;4141;0.00;true;1724502653;100347 Half Rim Rectangle Spring Hinge Eyeglasses;22.95;brown,black;false;https://www.glasseslit.com/Public/img/products/100347/C5_0.jpg;5;false;;https://codeaven.com/g/mmjnepjawo1e88db6f11de0721ef8d/?f_id=17760&ulp=https%3A%2F%2Fwww.glasseslit.com%2Fproinfo%2F100347-black-100347;Glasseslit;100347
true;Eyeglasses;USD;true;Add effortless style to your eyewear wardrobe with these minimalist square glasses. Made from thin high-quality acetate, the glossy hand-polished frame features a simplistic design. Amazingly versatile, the look wears well as both glasses and sunglasses. The style is super lightweight and provides maximum comfort for all-day wear. It is available in the following colors: clear and black, clear and gold, Grey.  ;4151;0.00;true;1724502653;200759 Square Spring Hinge Eyeglasses;25.95;clear and black,clear and gold,grey;false;https://www.glasseslit.com/Public/img/products/200759/C5_0.jpg;5;false;;https://codeaven.com/g/mmjnepjawo1e88db6f11de0721ef8d/?f_id=17760&ulp=https%3A%2F%2Fwww.glasseslit.com%2Fproinfo%2F200759-grey-200759;Glasseslit;200759
true;Sunglasses;USD;true;"The square sunglasses is folding. It is so easy to take along. With the spring hinges, it is comfortale to wear. The purple one has pink tint lenses; the pink one has amber tint lenses. If you want to order Rx sunglasses, please choose tint, polarized or photochromic lenses.";3875;0.00;true;1724416779;400157 Square Folding Spring Hinge Sunglasses;;pink,purple;false;https://www.glasseslit.com/Public/img/products/400157/pink_0.jpg;22.95;false;;https://codeaven.com/g/mmjnepjawo1e88db6f11de0721ef8d/?f_id=17760&ulp=https%3A%2F%2Fwww.glasseslit.com%2Fproinfo%2F400157-pink-400157;Glasseslit;400157
true;Sunglasses;USD;true;The square sunglasses has sunshade. It is so cool. With the wide temple arms, even on the sides of the face, it can protect you. Two colors are available: black and cream.  ;4065;0.00;true;1724330992;400202 Square Sunglasses;;black,cream;false;https://www.glasseslit.com/Public/img/products/400202/C1_0.jpg;29.95;false;;https://codeaven.com/g/mmjnepjawo1e88db6f11de0721ef8d/?f_id=17760&ulp=https%3A%2F%2Fwww.glasseslit.com%2Fproinfo%2F400202-cream-400202;Glasseslit;400202
true;Eyeglasses;USD;true;These chic rectangle glasses offer exceptional style and value. The medium-sized translucent frame is made with lightweight TR90 plastic for all-day comfort. It has a glossy finish and comes in the following options: grey, purple and pink.  ;4189;0.00;true;1724244606;200792 Rectangle Eyeglasses;;pink,grey;false;https://www.glasseslit.com/Public/img/products/200792/C6_0.jpg;19.95;false;;https://codeaven.com/g/mmjnepjawo1e88db6f11de0721ef8d/?f_id=17760&ulp=https%3A%2F%2Fwww.glasseslit.com%2Fproinfo%2F200792-purple-200792;Glasseslit;200792
true;Eyeglasses;USD;true;These glasses are part our classic eyewear line which feature stylishly smart looks.With an acetate rim and metal temple arms, the lightweight, rectangle frame is a solid choice for everyday glasses. ;2849;0.00;true;1724157472;Dana Rectangle Eyeglasses;33.95;purple;false;https://www.glasseslit.com/Public/img/products/B01180/C3_0.jpg;1;false;;https://codeaven.com/g/mmjnepjawo1e88db6f11de0721ef8d/?f_id=17760&ulp=https%3A%2F%2Fwww.glasseslit.com%2Fproinfo%2Fdana-purple-b01180;Glasseslit;B01180
true;Eyeglasses;USD;true;The round frame is mixed with titanium and acetate. It is very light. With the adjustable nose pads and spring hinges, it is comfortable to wear. Three colors are available: rose gold, blue, purple.  ;3995;0.00;true;1724157472;200720 Round Spring Hinges Eyeglasses;;purple,blue,rose gold;false;https://www.glasseslit.com/Public/img/products/200720/C3_0.jpg;29.95;false;;https://codeaven.com/g/mmjnepjawo1e88db6f11de0721ef8d/?f_id=17760&ulp=https%3A%2F%2Fwww.glasseslit.com%2Fproinfo%2F200720-rose_gold-200720;Glasseslit;200720
true;Eyeglasses;USD;true;"""This revamped aviator has an edgier profile than the classic style with more angular lenses and a broader brow bar. The wide, satin-finished metal frame front is complemented by acetate temple arms with a lustrous finish. The adjustable nose pads and spring hinges make the frame comfortable to wear. It is available in bronze with tortoiseshell temples arms.  ""  ";4009;0.00;true;1724157472;200723 Aviator Spring Hinges Eyeglasses;;bronze;false;https://www.glasseslit.com/Public/img/products/200723/C4_0.jpg;25.95;false;;https://codeaven.com/g/mmjnepjawo1e88db6f11de0721ef8d/?f_id=17760&ulp=https%3A%2F%2Fwww.glasseslit.com%2Fproinfo%2F200723-bronze-200723;Glasseslit;200723
true;Eyeglasses;USD;true;The square frame is very light. With the purple front and silver temple arms, it is in two-tone style. It is comfortable to wear due to the adjustable nose pads.  ;3966;0.00;true;1724157472;200716 Square Eyeglasses;;purple and silver;false;https://www.glasseslit.com/Public/img/products/200716/C88_0.jpg;28.95;false;;https://codeaven.com/g/mmjnepjawo1e88db6f11de0721ef8d/?f_id=17760&ulp=https%3A%2F%2Fwww.glasseslit.com%2Fproinfo%2F200716-purple_and_silver-200716;Glasseslit;200716
true;Eyeglasses;USD;true;Don’t be surprised if these round glasses become your go-to pair. Made with lightweight TR90 plastic and metal, the medium-sized colorful frame creats a gorgeous effect. It is available in pink and blue.  ;4010;0.00;true;1724157472;200725 Round Eyeglasses;;blue,pink;false;https://www.glasseslit.com/Public/img/products/200725/C19_0.jpg;22.95;false;;https://codeaven.com/g/mmjnepjawo1e88db6f11de0721ef8d/?f_id=17760&ulp=https%3A%2F%2Fwww.glasseslit.com%2Fproinfo%2F200725-pink-200725;Glasseslit;200725
true;Eyeglasses;USD;true;How lovely the titanium frame is. The temple tips are made of acetate. It is in two-tone design, the front is in rose gold and the temple arms are in floral. It is comfortable to wear due to the adjustable nose pads and spring hinges.  ;3996;0.00;true;1724157472;200721 Round Spring Hinges Eyeglasses;;rose gold;false;https://www.glasseslit.com/Public/img/products/200721/C3_0.jpg;29.95;false;;https://codeaven.com/g/mmjnepjawo1e88db6f11de0721ef8d/?f_id=17760&ulp=https%3A%2F%2Fwww.glasseslit.com%2Fproinfo%2F200721-rose_gold-200721;Glasseslit;200721
true;Eyeglasses;USD;true;Timeless style meets a modern shape in these minimalist geometric glasses. The titanium frame is wire thin with no extraneous details. For added comfort the look has adjustable nose pads and soft plastic temple tips. It comes in mint green.  ;3998;0.00;true;1724157472;200724 Geometric Eyeglasses;;mint green;false;https://www.glasseslit.com/Public/img/products/200724/C3_0.jpg;29.95;false;;https://codeaven.com/g/mmjnepjawo1e88db6f11de0721ef8d/?f_id=17760&ulp=https%3A%2F%2Fwww.glasseslit.com%2Fproinfo%2F200724-mint_green-200724;Glasseslit;200724
true;Eyeglasses;USD;true;Stand out in a good way in these unique geometric glasses. Made from our most durable material, the titanium frame features two-tone design. Comfort features like adjustable nose pads and spring hinges make this lightweight frame wearable all day. It comes in two colors: pink and red.  ;3997;0.00;true;1724157472;200722 Geometric Spring Hinges Eyeglasses;;pink,red;false;https://www.glasseslit.com/Public/img/products/200722/C5_0.jpg;29.95;false;;https://codeaven.com/g/mmjnepjawo1e88db6f11de0721ef8d/?f_id=17760&ulp=https%3A%2F%2Fwww.glasseslit.com%2Fproinfo%2F200722-red-200722;Glasseslit;200722
true;Eyeglasses;USD;true;Made with high-quality material, these glasses are durable and wear-resisting. It is a perfect ornament that lets you look both stylish and tasteful. It works well with everything so you can wear them every day. Go to buy them online!  ;4080;0.00;true;1724157472;200726 Square Eyeglasses;;tortoiseshell;false;https://www.glasseslit.com/Public/img/products/200726/C37_0.jpg;29.95;false;;https://codeaven.com/g/mmjnepjawo1e88db6f11de0721ef8d/?f_id=17760&ulp=https%3A%2F%2Fwww.glasseslit.com%2Fproinfo%2F200726-tortoiseshell-200726;Glasseslit;200726
true;Eyeglasses;USD;true;Made with premium materials, this pair of glasses is suitable for all-day comfort. It is a perfect ornament that makes you look both stylish and pretty. The cateye frame is casual and lovely, giving away a friendly impression. It is nice for ladies to wear it every day. Spring hinges make it comfortable to wear. It comes in two colors: blue and tortoiseshell.  ;4167;0.00;true;1724157472;200775 Cateye Spring Hinge Eyeglasses;;blue,tortoiseshell;false;https://www.glasseslit.com/Public/img/products/200775/tortoiseshell_0.jpg;22.95;false;;https://codeaven.com/g/mmjnepjawo1e88db6f11de0721ef8d/?f_id=17760&ulp=https%3A%2F%2Fwww.glasseslit.com%2Fproinfo%2F200775-tortoiseshell-200775;Glasseslit;200775
true;Eyeglasses;USD;true;Present your stylish style if you wear this pair of colorful cat-eye eyeglasses. Made with high-quality material, these glasses have a glossy finish. With the adjustable nosr pads and spring hinges, it is comfortable to wear. A perfect ornament for you on all occasions. It comes in two colors: rainbow and tortoiseshello.  ;4168;0.00;true;1724157472;200776 Cateye Spring Hinge Eyeglasses;;rainbow,tortoiseshell;false;https://www.glasseslit.com/Public/img/products/200776/rainbow_0.jpg;23.95;false;;https://codeaven.com/g/mmjnepjawo1e88db6f11de0721ef8d/?f_id=17760&ulp=https%3A%2F%2Fwww.glasseslit.com%2Fproinfo%2F200776-rainbow-200776;Glasseslit;200776
true;Eyeglasses;USD;true;Made with high-quality material, the geometric frame has spring hinges. The shape is different from the ordinary eyeglasses, letting you feel distinctive yet not exaggerated, unique yet understated. They are great for women and men and work well with all outfits. It comes in three colors: amber, blue and tortoiseshell.  ;4169;0.00;true;1724157472;200777 Geometric Spring Hinge Eyeglasses;;tortoiseshell,blue,amber;false;https://www.glasseslit.com/Public/img/products/200777/blue_0.jpg;22.95;false;;https://codeaven.com/g/mmjnepjawo1e88db6f11de0721ef8d/?f_id=17760&ulp=https%3A%2F%2Fwww.glasseslit.com%2Fproinfo%2F200777-blue-200777;Glasseslit;200777
true;Sunglasses;USD;true;Popular classics and the cat-eye shape, come together beautifully in this pair of women's frames. These chunky cat-eye glasses have an adorable, retro vibe that works great for sunglasses. Suitable for all faces. It comes in tortoiseshell, beige, black, black and white, black and red.  ;4030;0.00;true;1724071882;100276 Cateyte Sunglasses;;black and white,black and red;false;https://www.glasseslit.com/Public/img/products/100276/black and white_0.jpg;25.95;false;;https://codeaven.com/g/mmjnepjawo1e88db6f11de0721ef8d/?f_id=17760&ulp=https%3A%2F%2Fwww.glasseslit.com%2Fproinfo%2F100276-black_and_red-100276;Glasseslit;100276
true;Eyeglasses;USD;true;Embrace the perfect combination of fashion and comfort with the red fashion glasses. It is an ideal ornament that makes you look both stylish and sexy. The trendy red glasses are made with acetate, which is very durable and wear-resistant. Importantly, you can get so high-quality eyeglasses at an affordable price. The sping hinges make it comfortable to wear.  ;4211;0.00;true;1724071882;200804 Cateye Spring Hinge Eyeglasses;;red;false;https://www.glasseslit.com/Public/img/products/200804/C2_0.jpg;29.95;false;;https://codeaven.com/g/mmjnepjawo1e88db6f11de0721ef8d/?f_id=17760&ulp=https%3A%2F%2Fwww.glasseslit.com%2Fproinfo%2F200804-red-200804;Glasseslit;200804
true;Sunglasses;USD;true;This could be the day to transform your look. With aviator-shaped rims, it gives a new vibe to your presence. Made out of metal ans tr90, the frame is light and flexible. You may notice the retro design with double bridges between the rims. This design gives a distinctive impression and at the same time provides extra comfort to its wearer due to the spring hinges. It is available in three color options: black, brown and blue.  ;4039;0.00;true;1723896146;400176 Aviator Spring Hinge Sunglasses;;blue;false;https://www.glasseslit.com/Public/img/products/400176/C2_0.jpg;25.95;false;;https://codeaven.com/g/mmjnepjawo1e88db6f11de0721ef8d/?f_id=17760&ulp=https%3A%2F%2Fwww.glasseslit.com%2Fproinfo%2F400176-blue-400176;Glasseslit;400176
true;Eyeglasses;USD;true;This aviator frame with double nose bridges and striking silhouette gives it a fashionable style. The full-rimmed design allows maximum visibility and comfort. In addition, the adjustable nose pads offer the extra comfort.;3469;0.00;true;1723726415;Serafina Aviator Eyeglasses;;burgundy,black,green and yellow,purple and brown,blue and yellow;false;https://www.glasseslit.com/Public/img/products/200359/C4_0.jpg;32.95;false;;https://codeaven.com/g/mmjnepjawo1e88db6f11de0721ef8d/?f_id=17760&ulp=https%3A%2F%2Fwww.glasseslit.com%2Fproinfo%2Fserafina-black-200359;Glasseslit;200359
true;Sunglasses;USD;true;"""A modified Rectangle style full-rim frame, with a more solid feel. It has two-bridge design. The adjustable nose pads make it comfortable to wear. It comes in two colors: black and gold.  ""  ";4067;0.00;true;1723642495;400197 Rectangle Sunglasses;;black;false;https://www.glasseslit.com/Public/img/products/400197/C1_0.jpg;29.95;false;;https://codeaven.com/g/mmjnepjawo1e88db6f11de0721ef8d/?f_id=17760&ulp=https%3A%2F%2Fwww.glasseslit.com%2Fproinfo%2F400197-black-400197;Glasseslit;400197
true;Eyeglasses;USD;true;The medium sized frame is made in acetate with spring hinges. With the unique colors, it is an unisex type. It can also be reading glasses. For the blue stripe one, there is yellow or brown color inside of the front frame.;3729;0.00;true;1723554378;200536 Oval Spring Hinge Glasses;;ink;false;https://www.glasseslit.com/Public/img/products/200536/C2_0.jpg;22.95;false;;https://codeaven.com/g/mmjnepjawo1e88db6f11de0721ef8d/?f_id=17760&ulp=https%3A%2F%2Fwww.glasseslit.com%2Fproinfo%2F200536-ink-200536;Glasseslit;200536
true;Eyeglasses;USD;true;The retro oval frame has pattern on the metal temple arms and bridge. It is made in metal and TR90. With the adjustable nose pads, it is comfortable to wear. Two colors available: tortoiseshell and black.  ;3963;0.00;true;1723554378;200713 Oval Eyeglasses;;tortoiseshell,black;false;https://www.glasseslit.com/Public/img/products/200713/C24_0.jpg;25.95;false;;https://codeaven.com/g/mmjnepjawo1e88db6f11de0721ef8d/?f_id=17760&ulp=https%3A%2F%2Fwww.glasseslit.com%2Fproinfo%2F200713-tortoiseshell-200713;Glasseslit;200713
true;Eyeglasses;USD;true;The oval frame has the butterfly shape but it s a unisex type. It has two-tone design. Made in metal and in light weight. With the adjustable nose pads, it is comfortable to wear. Two colors available: tortoiseshell and gold, black and gold.  ;3965;0.00;true;1723554378;200715 Oval Eyeglasses;;black and gold,silver;false;https://www.glasseslit.com/Public/img/products/200715/C10-2_0.jpg;25.95;false;;https://codeaven.com/g/mmjnepjawo1e88db6f11de0721ef8d/?f_id=17760&ulp=https%3A%2F%2Fwww.glasseslit.com%2Fproinfo%2F200715-black_and_gold-200715;Glasseslit;200715
true;Eyeglasses;USD;true;The round frame is made of metal and tr90. It is in retro and unisex type. The tortoiseshell color makes the frame alive.  ;3977;0.00;true;1723554378;200712 Round Eyeglasses;;tortoiseshell;false;https://www.glasseslit.com/Public/img/products/200712/C30_0.jpg;15.95;false;;https://codeaven.com/g/mmjnepjawo1e88db6f11de0721ef8d/?f_id=17760&ulp=https%3A%2F%2Fwww.glasseslit.com%2Fproinfo%2F200712-tortoiseshell-200712;Glasseslit;200712
true;Eyeglasses;USD;true;"The oval frame is a unisex type. It has two-tone design. Made in metal and in light weight. With the adjustable nose pads, it is comfortable to wear. It can be made as sunglasses if you choose tint, polarized or photochromic lenses. Two colors available: black and silver; black and gold.  ";3978;0.00;true;1723554378;200711 Oval Eyeglasses;;black and gold,black and silver;false;https://www.glasseslit.com/Public/img/products/200711/C12_0.jpg;15.95;false;;https://codeaven.com/g/mmjnepjawo1e88db6f11de0721ef8d/?f_id=17760&ulp=https%3A%2F%2Fwww.glasseslit.com%2Fproinfo%2F200711-black_and_silver-200711;Glasseslit;200711
true;Eyeglasses;USD;true;The oval purple tortoiseshell frame is very light due to the TR90 material. There is metal design on the corner of the temple arms. With the adjustable nose pads, it is comfortable to wear.  ;4075;0.00;true;1723554378;200705 Oval Eyeglasses;;purple;false;https://www.glasseslit.com/Public/img/products/200705/C5_0.jpg;25.95;false;;https://codeaven.com/g/mmjnepjawo1e88db6f11de0721ef8d/?f_id=17760&ulp=https%3A%2F%2Fwww.glasseslit.com%2Fproinfo%2F200705-purple-200705;Glasseslit;200705
true;Eyeglasses;USD;true;This retro browline style looks as fresh today as it did when it first arrived on the scene more than 50 years ago. The small frame works equally well for hip, everyday glasses or sunglasses. It is available in matter black and brilliant black. For the brilliant black it has silver metal.  ;4076;0.00;true;1723554378;200708 Browline Eyeglasses;;brilliant black,black;false;https://www.glasseslit.com/Public/img/products/200708/C5_0.jpg;25.95;false;;https://codeaven.com/g/mmjnepjawo1e88db6f11de0721ef8d/?f_id=17760&ulp=https%3A%2F%2Fwww.glasseslit.com%2Fproinfo%2F200708-black-200708;Glasseslit;200708
true;Eyeglasses;USD;true;Give your look a warm touch with soft neutrals.  This small frame is available in the purple tortoiseshell. The nose bridge features fine filigree detail. Acetate temple tips and adjustable nose pads provide all-day comfort.  ;4077;0.00;true;1723554378;200709 Browline Eyeglasses;;purple;false;https://www.glasseslit.com/Public/img/products/200709/C10_0.jpg;25.95;false;;https://codeaven.com/g/mmjnepjawo1e88db6f11de0721ef8d/?f_id=17760&ulp=https%3A%2F%2Fwww.glasseslit.com%2Fproinfo%2F200709-purple-200709;Glasseslit;200709
true;Eyeglasses;USD;true;Your classic, full-rim, rectangular, metal Men's eyeglasses frame. It comes in bronze or black and features silicone nose pads so you can secure the glasses comfortably on your nose. The special design in the corner of the temple arms lift this frame out of the neighborhood of boring and into the realm of the subtly stylish.  ;4078;0.00;true;1723554378;200710 Rectangle Eyeglasses;;bronze,black;false;https://www.glasseslit.com/Public/img/products/200710/C4_0.jpg;25.95;false;;https://codeaven.com/g/mmjnepjawo1e88db6f11de0721ef8d/?f_id=17760&ulp=https%3A%2F%2Fwww.glasseslit.com%2Fproinfo%2F200710-bronze-200710;Glasseslit;200710
true;Sunglasses;USD;true;These are the glasses for the special you. Featuring a combination of plastic cateye-shaped rims with a tight bridge between the rims, and streamlined metal temples with ribbon-like golden ornaments, the glasses gives you a distinguished look with a somewhat elegant impression. It comes in amber, yellow and clear.  ;4042;0.00;true;1723034786;400179 Cateye Sunglasses;;clear;false;https://www.glasseslit.com/Public/img/products/400179/C5_0.jpg;25.95;false;;https://codeaven.com/g/mmjnepjawo1e88db6f11de0721ef8d/?f_id=17760&ulp=https%3A%2F%2Fwww.glasseslit.com%2Fproinfo%2F400179-clear-400179;Glasseslit;400179
true;Eyeglasses;USD;true;This shape of the frame has been hot for more than eight years on our website. This type is better than B00811 due to the spring hinges as well as the amazing colors. It should be the must-have one for our Glasseslit's fans.;3925;0.00;true;1722947868;200679 Cateye Spring Hinge Eyeglasses;;rainbow;false;https://www.glasseslit.com/Public/img/products/200679/C6_0.jpg;28.95;false;;https://codeaven.com/g/mmjnepjawo1e88db6f11de0721ef8d/?f_id=17760&ulp=https%3A%2F%2Fwww.glasseslit.com%2Fproinfo%2F200679-rainbow-200679;Glasseslit;200679
true;Sunglasses;USD;true;If you are looking up new sunglasses, this one is your best choice. They are made from TR90, very durable and sturdy. The square frame is stylish and beautiful, making you look very elegant and charm. Buy one pair for yourself! It comes in black, grey, amber and tortoiseshell.  ;4028;0.00;true;1722947868;100274 Square Sunglasses;;tortoiseshell,grey,amber;false;https://www.glasseslit.com/Public/img/products/100274/amber_0.jpg;20.95;false;;https://codeaven.com/g/mmjnepjawo1e88db6f11de0721ef8d/?f_id=17760&ulp=https%3A%2F%2Fwww.glasseslit.com%2Fproinfo%2F100274-amber-100274;Glasseslit;100274
true;Eyeglasses;USD;true;The elegent cat eye frame is suitable for reading glasses. Get it and to be the king. It is comfortable to wear with the spring hinges. It comes in two colors: floral and burgundy.;3917;0.00;true;1722947868;200673 Cateye Spring Hinge Eyeglasses;;red,floral;false;https://www.glasseslit.com/Public/img/products/200673/C2_0.jpg;23.95;false;;https://codeaven.com/g/mmjnepjawo1e88db6f11de0721ef8d/?f_id=17760&ulp=https%3A%2F%2Fwww.glasseslit.com%2Fproinfo%2F200673-floral-200673;Glasseslit;200673
true;Sunglasses;USD;true;These attractive rectangle glasses are made with high-quality tr90 which has a glossy finish. The wide frame is so suitable for sunglasses. It is a unisex type.  It is available in the following options: black, grey, amber and tortoiseshell.  ;4032;0.00;true;1722947868;100278 Rectangle Sunglasses;;tortoiseshell,amber,black,grey;false;https://www.glasseslit.com/Public/img/products/100278/grey_0.jpg;22.95;false;;https://codeaven.com/g/mmjnepjawo1e88db6f11de0721ef8d/?f_id=17760&ulp=https%3A%2F%2Fwww.glasseslit.com%2Fproinfo%2F100278-grey-100278;Glasseslit;100278
true;Sunglasses;USD;true;Sweet is the best way to describe these chic cat-eye glasses. The glossy TR90 plastic frame is both excellent  for daily use glasses and sunglasses. It comes in tortoiseshell, beige, black, black and white, black and red.  ;4033;0.00;true;1722947868;100279 Cateyte Sunglasses;;tortoiseshell,pink,black and white,black and red;false;https://www.glasseslit.com/Public/img/products/100279/tortoiseshell_0.jpg;25.95;false;;https://codeaven.com/g/mmjnepjawo1e88db6f11de0721ef8d/?f_id=17760&ulp=https%3A%2F%2Fwww.glasseslit.com%2Fproinfo%2F100279-tortoiseshell-100279;Glasseslit;100279
true;Eyeglasses;USD;true;The Cateye frame has spring hinges, so it is friendly to lady with not small face. There is diamond metal design on the temple armes. Two colors available: tortoiseshell and purple.;3910;0.00;true;1722947868;200663 Cateye Spring Hinge Eyeglasses;;purple,tortoiseshell;false;https://www.glasseslit.com/Public/img/products/200663/C5_0.jpg;25.95;false;;https://codeaven.com/g/mmjnepjawo1e88db6f11de0721ef8d/?f_id=17760&ulp=https%3A%2F%2Fwww.glasseslit.com%2Fproinfo%2F200663-purple-200663;Glasseslit;200663
true;Sunglasses;USD;true;Made with premium materials, these glasses are durable and wear-resisting. The frame will leave you a deep impression at first sight. This chic pair of eyeglasses is extremely versatile and comfortable. It comes in black, grey, amber and tortoiseshell.  ;4029;0.00;true;1722947868;100275 Oval Sunglasses;;grey;false;https://www.glasseslit.com/Public/img/products/100275/grey_0.jpg;20.95;false;;https://codeaven.com/g/mmjnepjawo1e88db6f11de0721ef8d/?f_id=17760&ulp=https%3A%2F%2Fwww.glasseslit.com%2Fproinfo%2F100275-grey-100275;Glasseslit;100275
true;Eyeglasses;USD;true;Crafted from a mixed material construction of plastic and metal, this fabulous frame uses its unique cat-eye shape to serve up a look that’s simply unforgettable. It has a carved face front. Designed with spring hinges and acetate temple tips for extra comfort and all-day style. Three colors are avaialble: clear, red and tortoiseshell.  ;4163;0.00;true;1722947868;200771 Cateye Spring Hinge Eyeglasses;;tortoiseshell,red,clear;false;https://www.glasseslit.com/Public/img/products/200771/tortoiseshell_0.jpg;22.95;false;;https://codeaven.com/g/mmjnepjawo1e88db6f11de0721ef8d/?f_id=17760&ulp=https%3A%2F%2Fwww.glasseslit.com%2Fproinfo%2F200771-tortoiseshell-200771;Glasseslit;200771
true;Eyeglasses;USD;true;The butterfly comes on strong with these chic frames for women. The full-rim butterfly crystal glasses features crystal color and will look fabulous as either everyday optical glasses or a fetching pair of polarized sunglasses. Go for the drama with these frames, available in two colors: clear and green.  ;4164;0.00;true;1722947868;200772 Cateye Spring Hinge Eyeglasses;;green,clear;false;https://www.glasseslit.com/Public/img/products/200772/green_0.jpg;22.95;false;;https://codeaven.com/g/mmjnepjawo1e88db6f11de0721ef8d/?f_id=17760&ulp=https%3A%2F%2Fwww.glasseslit.com%2Fproinfo%2F200772-green-200772;Glasseslit;200772
