available;categoryId;currencyId;delivery;description;id;local_delivery_cost;manufacturer_warranty;modified_time;name;oldprice;param;pickup;picture;price;store;type;url;vendor;vendorCode
true;Eyeglasses;USD;true;So unique square glasses. It is in vintage style. There are rivets on the front of the frame. With the adjustable nose pads, it is comfortable to wear.  It comes in two colors: tortoiseshell and clear.  ;3955;0.00;true;1722342515;200694 Square Eyeglasses;;clear;false;https://www.glasseslit.com/Public/img/products/200694/C2_0.jpg;29.95;false;;https://codeaven.com/g/mmjnepjawo1e88db6f11de0721ef8d/?f_id=17760&ulp=https%3A%2F%2Fwww.glasseslit.com%2Fproinfo%2F200694-clear-200694;Glasseslit;200694
true;Eyeglasses;USD;true;The elegant oval glasses will add polish to any look. The medium-narrow frame is made with lightweight TR90 and metal. It is for all-day comfort. It has a glossy finish and is available in tortoiseshell.   ;3976;0.00;true;1722342515;200718 Oval Eyeglasses;;other;false;https://www.glasseslit.com/Public/img/products/200718/C42_0.jpg;15.95;false;;https://codeaven.com/g/mmjnepjawo1e88db6f11de0721ef8d/?f_id=17760&ulp=https%3A%2F%2Fwww.glasseslit.com%2Fproinfo%2F200718-other-200718;Glasseslit;200718
true;Eyeglasses;USD;true;"""A half-rim rectangular frame made of titanium with nose pads and acetate temple tips. It has two-tone design: black and gold, black and silver.    ""  ";4005;0.00;true;1722342515;100294 Rectangle Eyeglasses;;black and gold,black and silver;false;https://www.glasseslit.com/Public/img/products/100294/C2_0.jpg;25.95;false;;https://codeaven.com/g/mmjnepjawo1e88db6f11de0721ef8d/?f_id=17760&ulp=https%3A%2F%2Fwww.glasseslit.com%2Fproinfo%2F100294-black_and_gold-100294;Glasseslit;100294
true;Sunglasses;USD;true;A timeless classic gets a reboot in these rectangle glasses. The glossy TR90 plastic style features silver metal accents and fun pops of color. The ultra lightweight, flexible frame is an ideal candidate for all-day wear.  It is available in the following color ways: grey, black, amber and tortoiseshell.  ;4023;0.00;true;1722342515;100286 Rectangle Sunglasses;;tortoiseshell,grey,amber;false;https://www.glasseslit.com/Public/img/products/100286/grey_0.jpg;22.95;false;;https://codeaven.com/g/mmjnepjawo1e88db6f11de0721ef8d/?f_id=17760&ulp=https%3A%2F%2Fwww.glasseslit.com%2Fproinfo%2F100286-grey-100286;Glasseslit;100286
true;Sunglasses;USD;true;The cateye frame is mixed with metal and tr90. It is in the hot style. Showcasing a slender majestic design with cateye-shaped rims connected by a lofty golden bridge, this frame gives away a prestigious impression. Three colors are availble: black, tortoiseshell, black and white.  ;4037;0.00;true;1722342515;400174 Cateye Sunglasses;;tortoiseshell;false;https://www.glasseslit.com/Public/img/products/400174/tortoiseshell_0.jpg;25.95;false;;https://codeaven.com/g/mmjnepjawo1e88db6f11de0721ef8d/?f_id=17760&ulp=https%3A%2F%2Fwww.glasseslit.com%2Fproinfo%2F400174-tortoiseshell-400174;Glasseslit;400174
true;Sunglasses;USD;true;"""It's time to look elegant. It's best feature is, of course, its diamond-like ornaments adorning the upper side of its square-shaped rims, which intensifies your graceful look. It comes in black, yellow, pink and grey.  ""  ";4051;0.00;true;1722342515;400194 Square Sunglasses;;black,grey,yellow;false;https://www.glasseslit.com/Public/img/products/400194/C2_0.jpg;25.95;false;;https://codeaven.com/g/mmjnepjawo1e88db6f11de0721ef8d/?f_id=17760&ulp=https%3A%2F%2Fwww.glasseslit.com%2Fproinfo%2F400194-grey-400194;Glasseslit;400194
true;Sunglasses;USD;true;With classic cateye design, these stylish glasses are made from high quality durable materials. Besides, combined with browline shape to highlight its unique style and depth, this cateye frame also provides soft nose pads for added comfort to all of the wearers. It comes in red, black, gold and silver.  ;4052;0.00;true;1722342515;400195 Cateye Sunglasses;;red,black,gold,silver;false;https://www.glasseslit.com/Public/img/products/400195/C4_0.jpg;25.95;false;;https://codeaven.com/g/mmjnepjawo1e88db6f11de0721ef8d/?f_id=17760&ulp=https%3A%2F%2Fwww.glasseslit.com%2Fproinfo%2F400195-gold-400195;Glasseslit;400195
true;Eyeglasses;USD;true;The square rimless frame has small zircons insert in the lenses. There is bling bling design outside of the lenses. For the temple tips, they are alll around the temple arms, so the frame friendly to the one who is metal sensitivity. It is also comfortable to wear due to the adjustable nose pads.   ;4054;0.00;true;1722342515;500001 Square Rimless Eyeglasses;;gold;false;https://www.glasseslit.com/Public/img/products/500001/gold_0.jpg;59.95;false;;https://codeaven.com/g/mmjnepjawo1e88db6f11de0721ef8d/?f_id=17760&ulp=https%3A%2F%2Fwww.glasseslit.com%2Fproinfo%2F500001-gold-500001;Glasseslit;500001
true;Eyeglasses;USD;true;The square rimless frame is suitable for work and party. There is special design on the temple arms. It can also be sunglasses if you choose tint or photochromic lenses. Get one for the coming holiday.  ;4059;0.00;true;1722342515;500006 Square Rimless Eyeglasses;;gold;false;https://www.glasseslit.com/Public/img/products/500006/gold_0.jpg;59.95;false;;https://codeaven.com/g/mmjnepjawo1e88db6f11de0721ef8d/?f_id=17760&ulp=https%3A%2F%2Fwww.glasseslit.com%2Fproinfo%2F500006-gold-500006;Glasseslit;500006
true;Sunglasses;USD;true;The round sunglasses has special design on the front frame. It has polarized lenses with blue color on top and pink in bottom. The Sping hinges as well as adjustable nose pads will offer comfort. No Rx can be added. It comes in green;3898;0.00;true;1722342515;400165 Round Spring Hinges Kids Sunglasses;;pink;false;https://www.glasseslit.com/Public/img/products/400165/pink_0.jpg;22.95;false;;https://codeaven.com/g/mmjnepjawo1e88db6f11de0721ef8d/?f_id=17760&ulp=https%3A%2F%2Fwww.glasseslit.com%2Fproinfo%2F400165-pink-400165;Glasseslit;400165
true;Sunglasses;USD;true;The geometric sunglasses has the bear shape. It has polarized lenses in grey color. The Sping hinges as well as adjustable nose pads will offer comfort. No Rx can be added. It comes in green;3899;0.00;true;1722342515;400166 Geometric Spring Hinges Kids Sunglasses;;gold;false;https://www.glasseslit.com/Public/img/products/400166/gold_0.jpg;22.95;false;;https://codeaven.com/g/mmjnepjawo1e88db6f11de0721ef8d/?f_id=17760&ulp=https%3A%2F%2Fwww.glasseslit.com%2Fproinfo%2F400166-gold-400166;Glasseslit;400166
true;Eyeglasses;USD;true;he wooden like frame is made in TR90, so it is very light. The rag on the frame is not the blemish, but it is the special design. It comes in brown.;3911;0.00;true;1722342515;200665 Rectangle Eyeglasses;;brown;false;https://www.glasseslit.com/Public/img/products/200665/brown_0.jpg;22.95;false;;https://codeaven.com/g/mmjnepjawo1e88db6f11de0721ef8d/?f_id=17760&ulp=https%3A%2F%2Fwww.glasseslit.com%2Fproinfo%2F200665-brown-200665;Glasseslit;200665
true;Eyeglasses;USD;true;The round frame is a typical shape. With the magnetic clip ons and spring hinges, it is comfortable to wear as sunglasses. It has the keyhole design, so it can be steady on your face. Three colors are available: black, pink and clear.;3923;0.00;true;1722342515;200677 Round Magnetic Clip on Glasses;29.95;pink,clear,black;false;https://www.glasseslit.com/Public/img/products/200677/C1_0.jpg;17;false;;https://codeaven.com/g/mmjnepjawo1e88db6f11de0721ef8d/?f_id=17760&ulp=https%3A%2F%2Fwww.glasseslit.com%2Fproinfo%2F200677-black-200677;Glasseslit;200677
true;Eyeglasses;USD;true;These fashionably smart yet very affordable half-rim glasses will elevate any look. The medium-wide rectangle metal frame is lightweight and features adjustable nose pads and plastic temple tips for added comfort. It is available in black and blue.  ;4000;0.00;true;1722342515;100288 Rectangle Eyeglasses;;blue;false;https://www.glasseslit.com/Public/img/products/100288/C3_0.jpg;20.95;false;;https://codeaven.com/g/mmjnepjawo1e88db6f11de0721ef8d/?f_id=17760&ulp=https%3A%2F%2Fwww.glasseslit.com%2Fproinfo%2F100288-blue-100288;Glasseslit;100288
true;Sunglasses;USD;true;Get ready to Look 'shiny' with this unique sunglasses! Displaying an extraordinary design with irregular rims and a sturdy bridge connecting the rims, it is unique and catchy. Its minimalist temples are semi-transparent to the point that you can see the inner structures. Made out of TR90, a thermoplastic material, these glasses are not only light and flexible but also very durable. It is available in several choices of color: black, blue, pink and amber.  ;4038;0.00;true;1722342515;400175 Geometric Sunglasses;;amber,black,pink,blue;false;https://www.glasseslit.com/Public/img/products/400175/C4_0.jpg;25.95;false;;https://codeaven.com/g/mmjnepjawo1e88db6f11de0721ef8d/?f_id=17760&ulp=https%3A%2F%2Fwww.glasseslit.com%2Fproinfo%2F400175-pink-400175;Glasseslit;400175
true;Sunglasses;USD;true;"""Because just being 'You' is enough. With a tidy design displaying large orderly rectangle rims and a tight bridge connecting the rims, the frame intensifies your confident look.  Your confident look is further enhanced by the silver color. The adjustable nose pads make the frame comfortable.  ""  ";4040;0.00;true;1722342515;400177 Aviator Sunglasses;;silver;false;https://www.glasseslit.com/Public/img/products/400177/C4_0.jpg;25.95;false;;https://codeaven.com/g/mmjnepjawo1e88db6f11de0721ef8d/?f_id=17760&ulp=https%3A%2F%2Fwww.glasseslit.com%2Fproinfo%2F400177-silver-400177;Glasseslit;400177
true;Sunglasses;USD;true;Take a trip back to the swinging ‘60s with these dramatic mid-century-modern-inspired cat-eye frames for women. It can only be fashion use or single vision use. Three colors are availble: red, zebra and tortoiseshell.  ;4070;0.00;true;1722342515;400201 Cateye Sunglasses;;red,zebra,tortoiseshell;false;https://www.glasseslit.com/Public/img/products/400201/C4_0.jpg;25.95;false;;https://codeaven.com/g/mmjnepjawo1e88db6f11de0721ef8d/?f_id=17760&ulp=https%3A%2F%2Fwww.glasseslit.com%2Fproinfo%2F400201-red-400201;Glasseslit;400201
true;Sunglasses;USD;true;This full-rim women's frame is made entirely from plastic. It features a simple design, easy on the eyes. There is a special design on the temple arms of the frame. Please note, the actual pattern on eyeglasses may vary slightly from the one pictured. It comes in three colors: green, black and tortoiseshell.  ;4068;0.00;true;1722342515;400198 Rectangle Sunglasses;;tortoiseshell,green,white;false;https://www.glasseslit.com/Public/img/products/400198/C4_0.jpg;25.95;false;;https://codeaven.com/g/mmjnepjawo1e88db6f11de0721ef8d/?f_id=17760&ulp=https%3A%2F%2Fwww.glasseslit.com%2Fproinfo%2F400198-tortoiseshell-400198;Glasseslit;400198
true;Sunglasses;USD;true;Using advanced edging technology, these sunglasses have a luxurious feel with subtly curved lenses. Make a bold statement in these geometric sunglasses with oval lenses. It comes in three colors: red, black and tortoiseshell.  ;4066;0.00;true;1722342515;400200 Geometric Sunglasses;;black,tortoiseshell,red;false;https://www.glasseslit.com/Public/img/products/400200/C1_0.jpg;25.95;false;;https://codeaven.com/g/mmjnepjawo1e88db6f11de0721ef8d/?f_id=17760&ulp=https%3A%2F%2Fwww.glasseslit.com%2Fproinfo%2F400200-black-400200;Glasseslit;400200
true;Sunglasses;USD;true;This narrow cat-eye is the perfect mix of retro and modern. The wide frame is made with lightweight TR90 plastic. It has a glossy finish and is available in pink, floral and tortoiseshell. Pair with a matching tint for a cool, monochromatic look.  ;4073;0.00;true;1722342515;400205 Cateye Sunglasses;;tortoiseshell;false;https://www.glasseslit.com/Public/img/products/400205/C7_0.jpg;25.95;false;;https://codeaven.com/g/mmjnepjawo1e88db6f11de0721ef8d/?f_id=17760&ulp=https%3A%2F%2Fwww.glasseslit.com%2Fproinfo%2F400205-tortoiseshell-400205;Glasseslit;400205
true;Sunglasses;USD;true;The colorful goggles bring fresh styles to you. It can be added single vision Rx lenses. The wide temple arms make the frame solid. Four colors are available: green, yellow, pink and grey.  ;4072;0.00;true;1722342515;400204 Oval Goggles Eyeglasses;;green,grey,yellow,pink;false;https://www.glasseslit.com/Public/img/products/400204/C11_0.jpg;22.95;false;;https://codeaven.com/g/mmjnepjawo1e88db6f11de0721ef8d/?f_id=17760&ulp=https%3A%2F%2Fwww.glasseslit.com%2Fproinfo%2F400204-yellow-400204;Glasseslit;400204
true;Sunglasses;USD;true;Using advanced edging technology and high-quality materials,  these sunglasses have a luxurious look. Go for maximum cool in these stylish aviator sunglasses. The matte TR90 plastic frame features modern elements like a simple brow bar and round temple arms. The well-constructed, ultra-lightweight look feels barely there on, and is amazing for all-day wear. It is available in the following colors: black, amber and grey.  ;4074;0.00;true;1722342515;400206 Aviator Sunglasses;;amber,black,grey;false;https://www.glasseslit.com/Public/img/products/400206/C3_0.jpg;25.95;false;;https://codeaven.com/g/mmjnepjawo1e88db6f11de0721ef8d/?f_id=17760&ulp=https%3A%2F%2Fwww.glasseslit.com%2Fproinfo%2F400206-amber-400206;Glasseslit;400206
true;Eyeglasses;USD;true;Stylish looks have texture, and these geometric glasses are no exception. The glossy hand-polished acetate frame features a contrasting brilliant black front section and temple arm, which adds depth. This look is a fantastic candidate for both glasses and sunglasses.  ;4081;0.00;true;1722342515;200744 Geometric Eyeglasses;;black;false;https://www.glasseslit.com/Public/img/products/200744/C2_0.jpg;25.95;false;;https://codeaven.com/g/mmjnepjawo1e88db6f11de0721ef8d/?f_id=17760&ulp=https%3A%2F%2Fwww.glasseslit.com%2Fproinfo%2F200744-black-200744;Glasseslit;200744
true;Eyeglasses;USD;true;Show your love for sleek lines in these effortlessly cool rectangle glasses. The hypoallergenic stainless steel frame features a chic cut-out design on the temple arms. For added comfort, the look is fitted with spring hinges, adjustable nose pads, and acetate temple tips. It comes in silver.  ;4085;0.00;true;1722342515;100307 Rectangle Spring Hinge Eyeglasses;;silver;false;https://www.glasseslit.com/Public/img/products/100307/silver_0.jpg;22.95;false;;https://codeaven.com/g/mmjnepjawo1e88db6f11de0721ef8d/?f_id=17760&ulp=https%3A%2F%2Fwww.glasseslit.com%2Fproinfo%2F100307-silver-100307;Glasseslit;100307
true;Eyeglasses;USD;true;These smart and stylish square glasses will enhance any look. The medium-narrow metal frame features special design for the bridge, adjustable nose pads, and acetate temple tips for a comfortable wear. It has a high-shine finish and comes in grey, black and rose gold  ;4084;0.00;true;1722342515;100306 Square Eyeglasses;;rose gold,grey,black;false;https://www.glasseslit.com/Public/img/products/100306/C3_0.jpg;29.95;false;;https://codeaven.com/g/mmjnepjawo1e88db6f11de0721ef8d/?f_id=17760&ulp=https%3A%2F%2Fwww.glasseslit.com%2Fproinfo%2F100306-grey-100306;Glasseslit;100306
true;Eyeglasses;USD;true;These stylish browline glasses are both simple and smart. Made from metal and acetate, it is fashionable. For added comfort, the look has adjustable nose pads. It comes in black and gold, brown.  ;4086;0.00;true;1722342515;100308 Browline Spring Hinge Eyeglasses;;brown,black and gold;false;https://www.glasseslit.com/Public/img/products/100308/C3_0.jpg;29.95;false;;https://codeaven.com/g/mmjnepjawo1e88db6f11de0721ef8d/?f_id=17760&ulp=https%3A%2F%2Fwww.glasseslit.com%2Fproinfo%2F100308-brown-100308;Glasseslit;100308
true;Eyeglasses;USD;true;The half-rim frame adds some whimsy to your eyewear wardrobe with these round glasses. The medium-wide metal frame features large lenses encased in a two-toned rim in pink and gold. The temple arms feature pink acetate. Adjustable nose pads provide a proper fit.  ;4088;0.00;true;1722342515;100310 Round Spring Hinge Eyeglasses;;pink;false;https://www.glasseslit.com/Public/img/products/100310/C6_0.jpg;29.95;false;;https://codeaven.com/g/mmjnepjawo1e88db6f11de0721ef8d/?f_id=17760&ulp=https%3A%2F%2Fwww.glasseslit.com%2Fproinfo%2F100310-pink-100310;Glasseslit;100310
true;Eyeglasses;USD;true;When clean and chic are your style buzzwords, these aviator glasses are just what you need. With metal accents and a chic brow bar, this thin, lightweight stainless steel frame features metal temple arms, adjustable nose pads, and acetate temple arms for added comfort. It comes in silver.  ;4087;0.00;true;1722342515;100309 Aviator Spring Hinge Eyeglasses;;silver;false;https://www.glasseslit.com/Public/img/products/100309/C2_0.jpg;29.95;false;;https://codeaven.com/g/mmjnepjawo1e88db6f11de0721ef8d/?f_id=17760&ulp=https%3A%2F%2Fwww.glasseslit.com%2Fproinfo%2F100309-silver-100309;Glasseslit;100309
true;Eyeglasses;USD;true;Less is definitely more in these contemporary square glasses. Made from bronzestainless steel, the frame features a wire-thin bridge and memory titanium temple arms. For added comfort, the look has adjustable nose pads and soft plastic temple tips. This style works well as both glasses and sunglasses.  ;4094;0.00;true;1722342515;100316 Square Spring Hinge Eyeglasses;;bronze;false;https://www.glasseslit.com/Public/img/products/100316/bronze_0.jpg;25.95;false;;https://codeaven.com/g/mmjnepjawo1e88db6f11de0721ef8d/?f_id=17760&ulp=https%3A%2F%2Fwww.glasseslit.com%2Fproinfo%2F100316-bronze-100316;Glasseslit;100316
true;Eyeglasses;USD;true;This geometric style will add subtle intrigue to your everyday look. For on-trend glasses, add one of our many colorful tint options. Adjustable nose pads provide a proper fit. It comes in purple.  ;4091;0.00;true;1722342515;100313 Geometric Eyeglasses;;purple;false;https://www.glasseslit.com/Public/img/products/100313/C3_0.jpg;25.95;false;;https://codeaven.com/g/mmjnepjawo1e88db6f11de0721ef8d/?f_id=17760&ulp=https%3A%2F%2Fwww.glasseslit.com%2Fproinfo%2F100313-purple-100313;Glasseslit;100313
true;Eyeglasses;USD;true;These round metal glasses are a true classic style. The narrow frame features adjustable nose pads, spring hinges, and acetate temple tips for a comfortable fit. It is available in purple.  ;4089;0.00;true;1722342515;100311 Round Spring Hinge Eyeglasses;;purple;false;https://www.glasseslit.com/Public/img/products/100311/purple_0.jpg;25.95;false;;https://codeaven.com/g/mmjnepjawo1e88db6f11de0721ef8d/?f_id=17760&ulp=https%3A%2F%2Fwww.glasseslit.com%2Fproinfo%2F100311-purple-100311;Glasseslit;100311
true;Eyeglasses;USD;true;These classic, value-priced aviators are a cool choice for sunglasses or everyday glasses. The medium-wide stainless-steel frame features adjustable nose pads and acetate temple arms for added comfort. It is available in brown and gold  ;4095;0.00;true;1722342515;100317 Aviator Eyeglasses;;brown and gold;false;https://www.glasseslit.com/Public/img/products/100317/C2_0.jpg;25.95;false;;https://codeaven.com/g/mmjnepjawo1e88db6f11de0721ef8d/?f_id=17760&ulp=https%3A%2F%2Fwww.glasseslit.com%2Fproinfo%2F100317-brown_and_gold-100317;Glasseslit;100317
true;Eyeglasses;USD;true;The full rim geometric frame is very light due to the titanium material. The two-tone colored design makes the frame lively. Adjustable nose pads provide a proper fit.   ;4092;0.00;true;1722342515;100314 Geometric Eyeglasses;;gold and green;false;https://www.glasseslit.com/Public/img/products/100314/C2_0.jpg;25.95;false;;https://codeaven.com/g/mmjnepjawo1e88db6f11de0721ef8d/?f_id=17760&ulp=https%3A%2F%2Fwww.glasseslit.com%2Fproinfo%2F100314-gold_and_green-100314;Glasseslit;100314
true;Eyeglasses;USD;true;OMG, how elegant the red full rim frame is. There is specical design at the corner of temple arms. The gold bridge makes the frame colorful. Adjustable nose pads provide a proper fit.    ;4093;0.00;true;1722342515;100315 Geometric Eyeglasses;;red;false;https://www.glasseslit.com/Public/img/products/100315/C5_0.jpg;25.95;false;;https://codeaven.com/g/mmjnepjawo1e88db6f11de0721ef8d/?f_id=17760&ulp=https%3A%2F%2Fwww.glasseslit.com%2Fproinfo%2F100315-red-100315;Glasseslit;100315
true;Eyeglasses;USD;true;Simple and chic, these rectangle glasses will become a staple in your eyewear wardrobe. The break-resistant titanium frame features a classic design and ultra-thin temple arms. For added comfort, the look has adjustable nose pads and soft plastic temple tips. It comes black and gold.  ;4096;0.00;true;1722342515;100318 Rectangle Eyeglasses;;black,gold;false;https://www.glasseslit.com/Public/img/products/100318/C1_0.jpg;25.95;false;;https://codeaven.com/g/mmjnepjawo1e88db6f11de0721ef8d/?f_id=17760&ulp=https%3A%2F%2Fwww.glasseslit.com%2Fproinfo%2F100318-black-100318;Glasseslit;100318
true;Eyeglasses;USD;true;The half-rim geometric frame has two-tone color in gold and brown. Made with metal titanium and acetate, it is durable. Adjustable nose pads as well as the spring hinges provide a proper fit.  ;4090;0.00;true;1722342515;100312  Geometric Spring Hinge Eyeglasses;;gold and brown;false;https://www.glasseslit.com/Public/img/products/100312/C5_0.jpg;29.95;false;;https://codeaven.com/g/mmjnepjawo1e88db6f11de0721ef8d/?f_id=17760&ulp=https%3A%2F%2Fwww.glasseslit.com%2Fproinfo%2F100312-gold_and_brown-100312;Glasseslit;100312
true;Eyeglasses;USD;true;These chic round glasses made from glossy hand-polished acetate, the frame features timeless design lines and slim temple arms. This look wears well as both glasses and sunglasses. It comes in grey.  ;4105;0.00;true;1722342515;200748 Round Eyeglasses;;grey;false;https://www.glasseslit.com/Public/img/products/200748/C3_0.jpg;12.95;false;;https://codeaven.com/g/mmjnepjawo1e88db6f11de0721ef8d/?f_id=17760&ulp=https%3A%2F%2Fwww.glasseslit.com%2Fproinfo%2F200748-grey-200748;Glasseslit;200748
true;Eyeglasses;USD;true;The geometric style will add subtle intrigue to your everyday look. For on-trend glasses, add one of our many colorful tint options. The special design for the bridge will make the frame comfortable to wear. It comes in three colors.  ;4108;0.00;true;1722342515;100322 Geometric Eyeglasses;;rose gold,gold and black,silver and black;false;https://www.glasseslit.com/Public/img/products/100322/C1-3_0.jpg;25.95;false;;https://codeaven.com/g/mmjnepjawo1e88db6f11de0721ef8d/?f_id=17760&ulp=https%3A%2F%2Fwww.glasseslit.com%2Fproinfo%2F100322-rose_gold-100322;Glasseslit;100322
true;Eyeglasses;USD;true;The classic, full-rim, rectangular, metal Men's eyeglasses frame comes in black and features silicone nose pads so you can secure the glasses comfortably on your nose. Little spots of color on the tips of the acetate temple sleeves lift this frame out of the neighborhood of boring and into the realm of the subtly stylish.  ;4111;0.00;true;1722342515;200752 Rectangle Eyeglasses;;black;false;https://www.glasseslit.com/Public/img/products/200752/C6_0.jpg;19.95;false;;https://codeaven.com/g/mmjnepjawo1e88db6f11de0721ef8d/?f_id=17760&ulp=https%3A%2F%2Fwww.glasseslit.com%2Fproinfo%2F200752-black-200752;Glasseslit;200752
true;Eyeglasses;USD;true;Made with rubber plastic material, the round frame is so light. The adjustable nose pads make the frame comfortable to wear. It comes in red and black.  ;4115;0.00;true;1722342515;200756 Round Eyeglasses;;red and black;false;https://www.glasseslit.com/Public/img/products/200756/C4_0.jpg;10.95;false;;https://codeaven.com/g/mmjnepjawo1e88db6f11de0721ef8d/?f_id=17760&ulp=https%3A%2F%2Fwww.glasseslit.com%2Fproinfo%2F200756-red_and_black-200756;Glasseslit;200756
true;Eyeglasses;USD;true; With a retro design displaying quare rims connected by a slender tight bridge, the metal frame looks neat, giving away a serious impression. Made out of light metal, these glasses are very durable. Equipped with light-textured nose pads, subtle hinges, glossy streamlined temples, and finely curved temple tips, you may find immediate comfort wearing it. It is available in two colors: grey, gold mixed with black.  ;4117;0.00;true;1722342515;100323 Square Eyeglasses;;gold and black,grey;false;https://www.glasseslit.com/Public/img/products/100323/C3-2_0.jpg;25.95;false;;https://codeaven.com/g/mmjnepjawo1e88db6f11de0721ef8d/?f_id=17760&ulp=https%3A%2F%2Fwww.glasseslit.com%2Fproinfo%2F100323-grey-100323;Glasseslit;100323
true;Eyeglasses;USD;true;"""Simplicity stands out in the square glasses. For added comfort, the look is fitted with adjustable nose pads and soft plastic temple tips. The lightweight stainless steel frame has two colors: black and gold.  ""  ";4124;0.00;true;1722342515;100320 Square Eyeglasses;;black,gold;false;https://www.glasseslit.com/Public/img/products/100320/C16_0.jpg;25.95;false;;https://codeaven.com/g/mmjnepjawo1e88db6f11de0721ef8d/?f_id=17760&ulp=https%3A%2F%2Fwww.glasseslit.com%2Fproinfo%2F100320-black-100320;Glasseslit;100320
true;Eyeglasses;USD;true;Score a classic look with a modern twist in the red geometric glasses. The stainless steel frame features ultra slim design lines and a geometric take on a round rim shape. For added comfort, the look has adjustable nose pads.  ;4121;0.00;true;1722342515;100327 Geometric Eyeglasses;;red;false;https://www.glasseslit.com/Public/img/products/100327/C02_0.jpg;25.95;false;;https://codeaven.com/g/mmjnepjawo1e88db6f11de0721ef8d/?f_id=17760&ulp=https%3A%2F%2Fwww.glasseslit.com%2Fproinfo%2F100327-red-100327;Glasseslit;100327
true;Eyeglasses;USD;true;Made from lightweight stainless steel, the frame features impossibly thin rims, bridge, and temple arms. This look is an amazing candidate for both glassses and sunglasses (try them with fashion-tinted lenses!). Adjustable nose pads and plastic temple tips provide added comfort. It comes in black and gold.  ;4127;0.00;true;1722342515;100332 Round Eyeglasses;;black and gold;false;https://www.glasseslit.com/Public/img/products/100332/C19_0.jpg;25.95;false;;https://codeaven.com/g/mmjnepjawo1e88db6f11de0721ef8d/?f_id=17760&ulp=https%3A%2F%2Fwww.glasseslit.com%2Fproinfo%2F100332-black_and_gold-100332;Glasseslit;100332
